{
  "schema_version": "1.0.0",
  "action_intent_id": "ai-demo-001",
  "org_id": "org-demo",
  "plant_id": "plant-demo",
  "prescription_id": "rx-demo-001",
  "asset_id": "asset.compressor.aux-1",
  "command": "STOP_IDLE_AUX",
  "params": {},
  "status": "pending_approval",
  "requested_by": "role:energy_manager",
  "capability_ref": "cap-aux-1-stop",
  "allowlist_version": "2026.08.21.1",
  "created_at": "2026-08-21T12:00:00Z"
}
